commit	val_recall_at_1	memory_gb	status	description
7f3ce7f	1.4000	1.0	keep	baseline
59a0be6	1.6500	0.9	keep	N_HEAD=4, GAMMA=0.5, BS=96
d4caa16	1.7000	0.9	keep	MATRIX_LR=0.0005, EMA_TAU=0.999
3e77ae7	1.8500	0.9	keep	EMB_LR=0.005, GAMMA=0.2
e9695ae	1.8500	0.9	keep	EMA_TAU=0.9995, LAMBDA=0.5, COV=0.05
3bbe85a	59.5579	2.0	keep	increase capacity (N_EMBD=384, DEPTH=5, N_HEAD=6)
f67f597	66.9701	1.8	keep	reduce memory (N_EMBD=256, BS=48)
4ef4d88	68.0104	1.1	keep	reduce memory (N_EMBD=192, DEPTH=4, BS=32)
f6ed905	68.2705	1.1	keep	BS=24 to fit under 1GB
e858e15	67.4902	0.9	keep	N_EMBD=160, N_HEAD=5 (under 1GB)
cc9ce98	68.1404	0.9	keep	N_EMBD=160, BS=28
87e912f	67.3602	0.9	keep	N_EMBD=160, BS=32
603587a	68.7906	1.0	keep	N_EMBD=176, BS=28 (over 1GB)
16e4b80	69.4408	1.0	keep	N_EMBD=168, BS=28 (over 1GB)
3970c7c	0.0000	0.0	crash	N_EMBD=164 (odd head dim)
c0725a3	67.8804	0.9	keep	N_EMBD=160, N_HEAD=4, BS=28
b5eac02	66.8401	1.0	keep	N_EMBD=168, BS=24 (over 1GB)
cff51b0	67.4902	1.2	keep	N_EMBD=160, DEPTH=5 (over 1GB)
1c9d6cd	68.5306	0.9	keep	N_EMBD=160, EMA_TAU=0.9995, BS=28
019f1d0	60.9883	0.9	discard	GAMMA=0.2, COV=0.05 (collapse)
eaf8674	68.0104	0.9	keep	SUBEXPR_WEIGHT=0.5
20fcfb7	67.4902	1.0	keep	N_EMBD=176, BS=24 (over 1GB)
01f45a2	68.4005	1.0	keep	N_EMBD=168, BS=24 (over 1GB)
ff81390	68.7906	0.9	keep	LR 0.001/0.01 (NEW BEST under 1GB)
18f4263	68.4005	0.9	keep	LR 0.002/0.02
b2db5b1	66.9701	0.9	keep	LR 0.0015/0.015
c63dcc8	68.5306	0.9	keep	WARMUP_RATIO=0.1
f1dadef	67.8804	0.9	keep	N_EMBD=164, N_HEAD=2
b5e8c19	68.0104	1.2	keep	DEPTH=5, BS=24 (over 1GB)
19b0668	67.7503	1.0	keep	N_EMBD=168, BS=24 (over 1GB)
86c89fd	67.7503	1.1	keep	N_EMBD=176, BS=20 (over 1GB)
2807997	69.9610	0.9	keep	remove iterative refinement (NEW BEST!)
7ae4c88	67.7503	1.0	keep	N_EMBD=168, no refinement (over 1GB)
92c4f85	68.4005	0.9	keep	LR 0.002/0.02, no refinement
0309259	68.0104	1.0	keep	N_EMBD=168, SUBEXPR_WEIGHT=0.35, BS=26
c092349	67.8804	1.0	discard	SUBEXPR_WEIGHT=0.5, VICREG_GAMMA=0.6
5f778fd	68.1404	1.0	keep	EMA_TAU=0.999, N_EMBD=168, BS=26
d7d5355	68.5306	1.0	keep	LR=0.0012/0.012, VICREG_COV=0.15
05121db	69.1808	1.0	keep	GELU predictor, N_EMBD=168, BS=26
